{
  "schemaVersion": 1,
  "version": "2026-06",
  "id": "tau-empire/cadre-fireblade",
  "name": "Cadre Fireblade",
  "factionId": "tau-empire",
  "keywords": [
    "Character",
    "Infantry",
    "Markerlight",
    "Grenades",
    "Fire Warrior"
  ],
  "factionKeywords": [
    "T'au Empire"
  ],
  "models": [
    {
      "id": "default",
      "name": "Cadre Fireblade",
      "move": 6,
      "toughness": 3,
      "save": 4,
      "wounds": 4,
      "leadership": 7,
      "objectiveControl": 1,
      "baseSizeMm": 32,
      "heightInches": 1.4
    }
  ],
  "unitComposition": {
    "sizes": [
      {
        "models": 1,
        "points": 65
      }
    ]
  },
  "rangedWeapons": [
    {
      "id": "fireblade-pulse-rifle",
      "name": "Fireblade pulse rifle",
      "kind": "ranged",
      "range": 30,
      "attacks": "2",
      "skill": 3,
      "strength": 5,
      "ap": 0,
      "damage": "2",
      "abilities": []
    }
  ],
  "meleeWeapons": [
    {
      "id": "close-combat-weapon",
      "name": "Close combat weapon",
      "kind": "melee",
      "range": null,
      "attacks": "2",
      "skill": 4,
      "strength": 3,
      "ap": 0,
      "damage": "1",
      "abilities": []
    }
  ],
  "coreAbilities": [
    {
      "id": "core.leader"
    }
  ],
  "abilities": [],
  "leader": {
    "canLead": []
  }
}
